[
  {
    "id": "cn-hong-kong-dinh-thai-binh",
    "slug": "dinh-thai-binh",
    "region": "cn-hong-kong",
    "country": "china",
    "region_name_vi": "Hồng Kông",
    "federal_district": "Đặc khu (HK/Macau)",
    "name_vi": "Đỉnh Thái Bình (Victoria Peak)",
    "name_zh": "太平山頂 (Tàipíng Shāndǐng)",
    "name_ru": "Пик Виктория",
    "name_en": "Victoria Peak (The Peak)",
    "categories": [
      "monument",
      "park_garden"
    ],
    "coordinates": {
      "lat": 22.2712,
      "lon": 114.1499
    },
    "address_vi": "Khu The Peak, đảo Hồng Kông, Đặc khu Hành chính Hồng Kông",
    "rating": {
      "value": 4.5,
      "count": 56000,
      "source": "Google",
      "as_of": "2026-07"
    },
    "review_summary_vi": "Du khách gần như nhất trí rằng khung cảnh toàn cảnh đường chân trời Hồng Kông và cảng Victoria nhìn từ trên đỉnh là đẹp bậc nhất chuyến đi, đặc biệt lúc hoàng hôn và khi thành phố lên đèn. Nhiều người khuyên đi Peak Tram sớm hoặc đặt vé trước để tránh xếp hàng dài, mang theo áo khoác vì trên đỉnh lộng gió, và nên đi bộ vòng Lugard Road để ngắm cảnh miễn phí.",
    "presentation_short_vi": "Đỉnh Thái Bình, thường gọi là The Peak, là ngọn núi cao nhất đảo Hồng Kông và điểm ngắm cảnh nổi tiếng nhất thành phố. Từ các đài quan sát như Sky Terrace 428, du khách được chiêm ngưỡng toàn cảnh rừng cao ốc chọc trời, cảng Victoria và bán đảo Cửu Long trải dài phía dưới.",
    "presentation_short_en": "Victoria Peak, popularly known as The Peak, is the highest hill on Hong Kong Island and the city's most famous viewpoint. From lookouts such as Sky Terrace 428, visitors take in a sweeping panorama of the skyscraper skyline, Victoria Harbour and the Kowloon peninsula spread out below.",
    "presentation_short_ru": "Пик Виктория, известный как The Peak, — самая высокая гора острова Гонконг и самая знаменитая смотровая точка города. Со смотровых площадок, таких как Sky Terrace 428, открывается широкая панорама небоскрёбов, гавани Виктория и полуострова Коулун, раскинувшихся внизу.",
    "presentation_long_vi": "Đỉnh Thái Bình, được cả thế giới biết đến với tên The Peak, cao khoảng 552 mét và là điểm cao nhất trên đảo Hồng Kông. Ngay từ thời thuộc địa, đây đã là khu nghỉ dưỡng sang trọng của giới thượng lưu nhờ khí hậu mát mẻ và tầm nhìn ngoạn mục. Ngày nay, The Peak là điểm tham quan hút khách bậc nhất thành phố, nơi du khách phóng tầm mắt bao quát rừng nhà chọc trời san sát, cảng Victoria lấp lánh và bán đảo Cửu Long phía bên kia bờ. Cách lên đỉnh nổi tiếng và thú vị nhất là ngồi Peak Tram, tuyến đường sắt leo núi lịch sử vận hành từ năm 1888, đưa du khách vượt dốc gần như dựng đứng lên tới nhà ga trên cao. Tại đỉnh có tháp Peak Tower hình chiếc đe độc đáo với đài quan sát Sky Terrace 428 ở độ cao 428 mét so với mực nước biển, cùng khu mua sắm Peak Galleria. Du khách còn có thể tản bộ theo con đường Lugard Road bằng phẳng quanh sườn núi để ngắm cảnh miễn phí giữa cây xanh mát rượi. Cảnh đẹp nhất là lúc chiều tà chuyển sang đêm, khi cả Hồng Kông bừng sáng dưới chân, tạo nên một trong những khung cảnh đô thị đáng nhớ nhất châu Á.",
    "presentation_long_en": "Victoria Peak, known worldwide simply as The Peak, rises about 552 metres and is the highest point on Hong Kong Island. Since colonial times it has been an exclusive residential retreat, prized for its cooler air and spectacular outlook. Today The Peak is the city's single most popular attraction, where visitors survey a breathtaking panorama of densely packed skyscrapers, the glittering Victoria Harbour and the Kowloon peninsula on the far shore. The most celebrated way up is the Peak Tram, a historic funicular railway running since 1888 that hauls passengers up an almost vertical slope to the upper terminus. At the top stands the anvil-shaped Peak Tower, crowned by the Sky Terrace 428 observation deck at 428 metres above sea level, alongside the Peak Galleria shopping complex. Visitors can also stroll the gentle, tree-shaded Lugard Road that loops around the hillside for superb free views. The scene is at its finest as dusk turns to night, when the whole of Hong Kong lights up below, creating one of the most memorable urban vistas in Asia and a must for every first-time visitor.",
    "presentation_long_ru": "Пик Виктория, известный во всём мире просто как The Peak, поднимается примерно на 552 метра и является высшей точкой острова Гонконг. Ещё с колониальных времён это престижный жилой район, который ценят за более прохладный воздух и великолепные виды. Сегодня The Peak — самая посещаемая достопримечательность города, откуда открывается захватывающая панорама плотно стоящих небоскрёбов, сверкающей гавани Виктория и полуострова Коулун на другом берегу. Самый знаменитый способ подняться наверх — фуникулёр Peak Tram, историческая линия, действующая с 1888 года, которая поднимает пассажиров по почти отвесному склону к верхней станции. На вершине стоит башня Peak Tower в форме наковальни, увенчанная смотровой площадкой Sky Terrace 428 на высоте 428 метров над уровнем моря, рядом с торговым комплексом Peak Galleria. Посетители также могут прогуляться по пологой, затенённой деревьями дороге Лугард-роуд, огибающей склон холма, ради превосходных бесплатных видов. Особенно хорош пейзаж, когда сумерки переходят в ночь и весь Гонконг вспыхивает огнями внизу, создавая один из самых запоминающихся городских видов Азии.",
    "highlights_vi": [
      "Toàn cảnh đường chân trời Hồng Kông và cảng Victoria từ điểm cao nhất đảo",
      "Peak Tram lịch sử vận hành từ năm 1888 và đài quan sát Sky Terrace 428",
      "Đường dạo bộ Lugard Road ngắm cảnh miễn phí và tháp Peak Tower hình chiếc đe"
    ],
    "highlights_en": [
      "Panorama of the Hong Kong skyline and Victoria Harbour from the island's summit",
      "The historic Peak Tram running since 1888 and the Sky Terrace 428 deck",
      "The free Lugard Road viewpoint walk and the anvil-shaped Peak Tower"
    ],
    "highlights_ru": [
      "Панорама небоскрёбов Гонконга и гавани Виктория с высшей точки острова",
      "Исторический фуникулёр Peak Tram с 1888 года и площадка Sky Terrace 428",
      "Бесплатная прогулочная дорога Лугард-роуд и башня Peak Tower в форме наковальни"
    ],
    "practical": {
      "hours_vi": "Tham khảo: khu vực The Peak mở tự do cả ngày; Sky Terrace 428 thường mở khoảng 10:00–22:00 (cuối tuần mở sớm hơn); Peak Tram chạy khoảng 7:00–23:00. Giờ có thể thay đổi.",
      "ticket_vi": "Lên đỉnh miễn phí; vé Peak Tram khứ hồi kèm Sky Terrace 428 tham khảo khoảng 148 HKD/người lớn, đi Peak Tram riêng rẻ hơn. Giá có thể thay đổi.",
      "duration_vi": "Khoảng 2–3 giờ.",
      "best_time_vi": "Cuối chiều để ngắm hoàng hôn rồi ở lại xem thành phố lên đèn; ngày trời quang tầm nhìn xa và đẹp nhất.",
      "tips_vi": "Nên đặt vé Peak Tram trước qua mạng để tránh xếp hàng dài; mang theo áo khoác mỏng vì trên đỉnh lộng gió; đi bộ vòng Lugard Road – Harlech Road khoảng 3,5 km để ngắm cảnh miễn phí và vắng người hơn."
    },
    "photo": null,
    "photo_credit": null,
    "maps": {
      "yandex": "https://yandex.com/maps/?text=%D0%9F%D0%B8%D0%BA%20%D0%92%D0%B8%D0%BA%D1%82%D0%BE%D1%80%D0%B8%D1%8F&ll=114.1499,22.2712&z=16",
      "google": "https://www.google.com/maps/search/?api=1&query=Victoria%20Peak%20%28The%20Peak%29%2C%20Cn%20Hong%20Kong%2C%20Russia"
    },
    "official_site": null,
    "sources": [],
    "tags": [
      "top",
      "landmark",
      "viewpoint",
      "nature",
      "outdoor"
    ],
    "status": "enriched",
    "last_updated": "2026-08"
  },
  {
    "id": "cn-hong-kong-tiem-sa-chuy",
    "slug": "tiem-sa-chuy",
    "region": "cn-hong-kong",
    "country": "china",
    "region_name_vi": "Hồng Kông",
    "federal_district": "Đặc khu (HK/Macau)",
    "name_vi": "Tiêm Sa Chủy và cảng Victoria",
    "name_zh": "尖沙咀・維多利亞港 (Jiānshāzuǐ · Wéiduōlìyà Gǎng)",
    "name_ru": "Чимсачёй и гавань Виктория",
    "name_en": "Tsim Sha Tsui & Victoria Harbour",
    "categories": [
      "square_street",
      "monument"
    ],
    "coordinates": {
      "lat": 22.294,
      "lon": 114.1686
    },
    "address_vi": "Bờ cảng Tiêm Sa Chủy, bán đảo Cửu Long, Hồng Kông",
    "rating": {
      "value": 4.6,
      "count": 42000,
      "source": "Google",
      "as_of": "2026-07"
    },
    "review_summary_vi": "Du khách mê mẩn khung cảnh đường chân trời đảo Hồng Kông nhìn từ bờ Tiêm Sa Chủy, nhất là khi màn trình diễn ánh sáng 'Symphony of Lights' diễn ra mỗi tối. Nhiều người khuyên đi phà Star Ferry ngang cảng để ngắm cảnh với giá rẻ, đến sớm chọn chỗ đẹp bên lan can bến cảng, và dạo bộ dọc những con phố mua sắm sầm uất phía sau.",
    "presentation_short_vi": "Tiêm Sa Chủy là khu vực sầm uất ở mũi nam bán đảo Cửu Long, nhìn thẳng ra cảng Victoria và đường chân trời rực rỡ của đảo Hồng Kông. Bờ cảng nơi đây là chỗ ngắm cảnh biểu tượng, có Tháp Đồng Hồ cổ, bến phà Star Ferry và màn trình diễn ánh sáng 'Symphony of Lights' mỗi tối.",
    "presentation_short_en": "Tsim Sha Tsui is the bustling district at the southern tip of the Kowloon peninsula, facing Victoria Harbour and the dazzling skyline of Hong Kong Island. Its waterfront is an iconic viewpoint, home to the old Clock Tower, the Star Ferry pier and the nightly 'Symphony of Lights' show.",
    "presentation_short_ru": "Чимсачёй — оживлённый район на южной оконечности полуострова Коулун, обращённый к гавани Виктория и ослепительной панораме острова Гонконг. Его набережная — культовая смотровая точка со старинной Часовой башней, пристанью Star Ferry и ежевечерним шоу «Симфония огней».",